{
  "format": "machine/2",
  "machine": "Gate",
  "version": "1",
  "title": "An agent turn that a human can pause (the fragment Pause of the format, expanded): common events, the previous state, words of an enhanced gate",
  "data": [
    { "name": "turns", "type": "int>=0", "initial": { "expr": { "op": "lit", "value": 0 } }, "monotonic": true },
    { "name": "halt", "type": "\"\" | \"pause_halt\" | \"failed\"", "initial": { "expr": { "op": "lit", "value": "" } }, "writes": "rows_and_fragment" },
    { "name": "previous", "type": "?text", "initial": { "expr": { "op": "lit", "value": null } }, "writes": "rows_and_fragment" },
    { "name": "agent_attempt", "type": "int>=0", "initial": { "expr": { "op": "lit", "value": 0 } }, "monotonic": true, "writes": "mechanics" },
    { "name": "enhanced_attempt", "type": "int>=0", "initial": { "expr": { "op": "lit", "value": 0 } }, "monotonic": true, "writes": "mechanics" }
  ],
  "parties": [
    { "name": "agent", "id": "agent", "kind": "agent", "result": "text", "counter": "agent_attempt" },
    {
      "name": "enhanced", "id": "enhanced", "kind": "enhanced", "counter": "enhanced_attempt",
      "words": [
        { "name": "continue", "fields": [ { "name": "author", "type": "text" }, { "name": "source", "type": "text" } ] },
        { "name": "halt" }
      ]
    }
  ],
  "signals": [ { "name": "stop", "fields": [ { "name": "author", "type": "text" }, { "name": "source", "type": "text" } ] } ],
  "initial": "Work",
  "common_events": [
    {
      "n": 1, "event": { "kind": "signal", "name": "stop", "bind": { "author": "author", "source": "source" } },
      "cond": { "op": "and",
        "left": { "op": "not", "operand": { "op": "call", "fn": "end", "args": [ { "op": "name", "name": "state" } ] } },
        "right": { "op": "!=", "left": { "op": "name", "name": "state" }, "right": { "op": "lit", "value": "Pause" } } },
      "actions": [
        { "do": "journal", "code": "human_stop", "params": [
            { "name": "author", "value": { "op": "name", "name": "author" } },
            { "name": "source", "value": { "op": "name", "name": "source" } },
            { "name": "event", "value": { "op": "field", "of": { "op": "name", "name": "event" }, "name": "id" } } ] },
        { "do": "assign", "target": "previous", "value": { "op": "name", "name": "state" } },
        { "do": "cancel_open" }
      ],
      "to": "Pause"
    },
    {
      "n": 2, "event": { "kind": "signal", "name": "stop", "bind": { "author": "author" } }, "else": true,
      "actions": [ { "do": "journal", "code": "stop_discarded", "params": [ { "name": "author", "value": { "op": "name", "name": "author" } } ] } ],
      "to": "@same"
    }
  ],
  "states": [
    {
      "name": "Work", "kind": "appeal", "party": "agent",
      "inputs": [
        { "field": "task", "value": { "op": "lit", "value": "work" }, "reads": "party" },
        { "field": "turns", "value": { "op": "name", "name": "turns" }, "reads": "executor" }
      ],
      "rows": [
        {
          "n": 1, "event": { "kind": "answer" },
          "actions": [
            { "do": "journal", "code": "work_done" },
            { "do": "assign", "target": "turns", "value": { "op": "+", "left": { "op": "name", "name": "turns" }, "right": { "op": "lit", "value": 1 } } }
          ],
          "to": "Done"
        },
        {
          "n": 2, "event": { "kind": "failure", "bind": "why" },
          "actions": [
            { "do": "journal", "code": "work_failed", "params": [ { "name": "reason", "value": { "op": "call", "fn": "text", "args": [ { "op": "name", "name": "why" } ] } } ] },
            { "do": "assign", "target": "halt", "value": { "op": "lit", "value": "failed" } }
          ],
          "to": "Halted"
        }
      ]
    },
    {
      "name": "Pause", "kind": "appeal", "party": "enhanced",
      "inputs": [ { "field": "previous", "value": { "op": "call", "fn": "require", "args": [ { "op": "name", "name": "previous" } ] }, "reads": "executor" } ],
      "rows": [
        {
          "n": 1, "event": { "kind": "word", "word": "continue", "bind": { "author": "author", "source": "source" } },
          "actions": [
            { "do": "journal", "code": "human_continue", "params": [
                { "name": "previous", "value": { "op": "call", "fn": "text", "args": [ { "op": "call", "fn": "require", "args": [ { "op": "name", "name": "previous" } ] } ] } },
                { "name": "author", "value": { "op": "name", "name": "author" } },
                { "name": "source", "value": { "op": "name", "name": "source" } } ] }
          ],
          "to": "@previous"
        },
        {
          "n": 2, "event": { "kind": "word", "word": "halt" },
          "actions": [ { "do": "assign", "target": "halt", "value": { "op": "lit", "value": "pause_halt" } } ],
          "to": "Halted"
        }
      ]
    },
    { "name": "Done", "kind": "end", "reads": [ "turns" ] },
    { "name": "Halted", "kind": "end", "reads": [ "halt" ], "except": { "field": "halt", "values": [ "" ] } }
  ],
  "ends": {
    "result": "text",
    "rows": [
      { "state": "Done", "n": 1, "when": { "op": "lit", "value": true }, "answer": { "kind": "answer", "value": { "op": "call", "fn": "text", "args": [ { "op": "name", "name": "turns" } ] } } },
      {
        "state": "Halted", "n": 1, "when": { "op": "==", "left": { "op": "name", "name": "halt" }, "right": { "op": "lit", "value": "pause_halt" } },
        "answer": { "kind": "refusal", "code": { "op": "variant", "type": "FailCode", "name": "StoppedByHuman" }, "text": { "op": "lit", "value": "paused and stopped" } }
      },
      {
        "state": "Halted", "n": 2, "when": { "op": "==", "left": { "op": "name", "name": "halt" }, "right": { "op": "lit", "value": "failed" } },
        "answer": { "kind": "refusal", "code": { "op": "variant", "type": "FailCode", "name": "NoResult" }, "text": { "op": "lit", "value": "the turn failed" } }
      }
    ]
  }
}
